{
  "contract_version": "review-input.v1",
  "run_id": "11111111-1111-4111-8111-111111111111",
  "document_source_id": "source-main",
  "sources": [
    {
      "id": "source-main",
      "role": "document",
      "name": "synthetic-spec.md",
      "media_type": "text/markdown",
      "sha256": "aaaaaaaaaaaaaaaaaaaaaaaaaaaaaaaaaaaaaaaaaaaaaaaaaaaaaaaaaaaaaaaa",
      "status": "available",
      "diagnostics": [],
      "fragments": [
        {
          "id": "source-main-lines-1-3",
          "kind": "text",
          "text": "Обновление витрины выполняется регулярно. Точное расписание не указано.",
          "location": {
            "line_start": 1,
            "line_end": 3
          }
        }
      ]
    },
    {
      "id": "source-context",
      "role": "context",
      "name": "review-rules.txt",
      "media_type": "text/plain",
      "sha256": "bbbbbbbbbbbbbbbbbbbbbbbbbbbbbbbbbbbbbbbbbbbbbbbbbbbbbbbbbbbbbbbb",
      "status": "unavailable",
      "diagnostics": [
        {
          "code": "not_found",
          "message": "Синтетический источник контекста недоступен в снимке запуска."
        }
      ],
      "fragments": []
    }
  ],
  "review_scope": {
    "target_fragment_ids": [
      "source-main-lines-1-3"
    ]
  },
  "profile": {
    "id": "base-data-spec",
    "version": "1.0.0",
    "name": "Базовая проверка ТЗ на данные",
    "role": "Аналитик с ракурсами разработчика и тестировщика",
    "goal": "Найти неоднозначности до передачи ТЗ в разработку",
    "checks": [
      "Проверить расписание, временные зоны и повторный запуск"
    ]
  },
  "options": {
    "locale": "ru-RU",
    "max_findings": 100
  }
}
